{
  "binding_id": "ppb-two-cut-book",
  "contract": "gbrg.portfolio-position-binding.v0",
  "entities": {
    "regis:org:acme-capital": {
      "kind": "ORG",
      "name": "Acme Capital SA"
    },
    "regis:org:borealis-bank": {
      "kind": "ORG",
      "name": "Borealis Bank NV"
    },
    "regis:org:cygnus-energy": {
      "kind": "ORG",
      "name": "Cygnus Energy Ltd"
    },
    "regis:org:delphi-holdings": {
      "kind": "ORG",
      "name": "Delphi Holdings GmbH"
    }
  },
  "instruments": {
    "isin:XS-T1-CLO-A": {
      "asset_class": "credit",
      "f_builder": "simulate_credit",
      "issuer_ref": "regis:org:acme-capital",
      "structure": {
        "attach": 0.03,
        "detach": 0.07,
        "kind": "tranche"
      }
    },
    "isin:XS-T2-BOND": {
      "asset_class": "credit",
      "f_builder": "simulate_credit",
      "issuer_ref": "regis:org:borealis-bank"
    },
    "isin:XS-T3-BOND": {
      "asset_class": "credit",
      "f_builder": "simulate_credit",
      "issuer_ref": "regis:org:cygnus-energy"
    },
    "isin:XS-T4-BOND": {
      "asset_class": "credit",
      "f_builder": "simulate_credit",
      "issuer_ref": "regis:org:delphi-holdings"
    }
  },
  "positions": [
    {
      "exposure": 25.0,
      "instrument_ref": "isin:XS-T1-CLO-A",
      "leaf_ref": "t1",
      "position_id": "p-t1-a",
      "quantity": 600.0
    },
    {
      "exposure": 15.0,
      "instrument_ref": "isin:XS-T1-CLO-A",
      "leaf_ref": "t1",
      "position_id": "p-t1-b",
      "quantity": 400.0
    },
    {
      "exposure": 30.0,
      "instrument_ref": "isin:XS-T2-BOND",
      "leaf_ref": "t2",
      "position_id": "p-t2",
      "quantity": 1000.0
    },
    {
      "exposure": 20.0,
      "instrument_ref": "isin:XS-T3-BOND",
      "leaf_ref": "t3",
      "position_id": "p-t3",
      "quantity": 1000.0
    },
    {
      "exposure": 10.0,
      "instrument_ref": "isin:XS-T4-BOND",
      "leaf_ref": "t4",
      "position_id": "p-t4",
      "quantity": 1000.0
    }
  ],
  "tree": {
    "confidence": 0.95,
    "consumes": {
      "memory_regime": "economic-prophet:memory-regime-characterizer(in-flight)",
      "risk_kernel": "economic-prophet@feat/risk-adjusted-profit-raroc"
    },
    "contract": "gbrg.omnirisk-allocation.v0",
    "cuts": {
      "client_segment": {
        "children": [
          {
            "children": [
              {
                "label": {
                  "asset_class": "credit",
                  "org_cut": null,
                  "regime": {
                    "fractal_dim": 1.3,
                    "hurst": 0.7,
                    "lyapunov": 0.01,
                    "market_regime": "normal",
                    "memory_regime": "long_memory"
                  },
                  "structure": {
                    "attach": 0.03,
                    "detach": 0.07,
                    "kind": "tranche"
                  }
                },
                "node_ref": "t1",
                "risk": {
                  "alpha": 0.95,
                  "coherent": true,
                  "component_contribution": 40,
                  "distribution_id": "fp:t1",
                  "horizon": 1.0,
                  "measure": "expected_shortfall",
                  "n_samples": 250,
                  "provisional": false,
                  "risk_adjusted_return": 8.0,
                  "risk_ref": "economic-prophet@feat/risk-adjusted-profit-raroc:risk_measures.risk",
                  "standalone_capital": 55
                },
                "term": {
                  "average_life": 3.0,
                  "convexity": 6.0,
                  "duration": 2.0,
                  "kurtosis": 5.0,
                  "principal": 1000.0,
                  "skew": -0.5,
                  "tenor_bucket": "5y",
                  "term_regime": "upward",
                  "value": 1000.0
                }
              },
              {
                "label": {
                  "asset_class": "credit",
                  "org_cut": null,
                  "regime": {
                    "fractal_dim": 1.3,
                    "hurst": 0.7,
                    "lyapunov": 0.01,
                    "market_regime": "normal",
                    "memory_regime": "long_memory"
                  }
                },
                "node_ref": "t3",
                "risk": {
                  "alpha": 0.95,
                  "coherent": true,
                  "component_contribution": 20,
                  "distribution_id": "fp:t3",
                  "horizon": 1.0,
                  "measure": "expected_shortfall",
                  "n_samples": 250,
                  "provisional": false,
                  "risk_adjusted_return": 5.0,
                  "risk_ref": "economic-prophet@feat/risk-adjusted-profit-raroc:risk_measures.risk",
                  "standalone_capital": 28
                },
                "term": {
                  "average_life": 5.0,
                  "convexity": 25.0,
                  "duration": 4.0,
                  "kurtosis": 5.0,
                  "principal": 1000.0,
                  "skew": -0.5,
                  "tenor_bucket": "5y",
                  "term_regime": "upward",
                  "value": 1000.0
                }
              }
            ],
            "label": {
              "asset_class": "credit",
              "org_cut": "client_segment",
              "regime": {
                "fractal_dim": 1.3,
                "hurst": 0.7,
                "lyapunov": 0.01,
                "market_regime": "normal",
                "memory_regime": "long_memory"
              }
            },
            "node_ref": "Geo_US",
            "risk": {
              "alpha": 0.95,
              "coherent": true,
              "economic_capital": 60,
              "horizon": 1.0,
              "measure": "expected_shortfall"
            },
            "term": {
              "average_life": 4.0,
              "convexity": 15.5,
              "duration": 3.0
            }
          },
          {
            "children": [
              {
                "label": {
                  "asset_class": "credit",
                  "org_cut": null,
                  "regime": {
                    "fractal_dim": 1.3,
                    "hurst": 0.7,
                    "lyapunov": 0.01,
                    "market_regime": "normal",
                    "memory_regime": "long_memory"
                  }
                },
                "node_ref": "t2",
                "risk": {
                  "alpha": 0.95,
                  "coherent": true,
                  "component_contribution": 30,
                  "distribution_id": "fp:t2",
                  "horizon": 1.0,
                  "measure": "expected_shortfall",
                  "n_samples": 250,
                  "provisional": false,
                  "risk_adjusted_return": 6.0,
                  "risk_ref": "economic-prophet@feat/risk-adjusted-profit-raroc:risk_measures.risk",
                  "standalone_capital": 40
                },
                "term": {
                  "average_life": 8.0,
                  "convexity": 50.0,
                  "duration": 6.0,
                  "kurtosis": 5.0,
                  "principal": 1000.0,
                  "skew": -0.5,
                  "tenor_bucket": "5y",
                  "term_regime": "upward",
                  "value": 1000.0
                }
              },
              {
                "label": {
                  "asset_class": "credit",
                  "org_cut": null,
                  "regime": {
                    "fractal_dim": 1.3,
                    "hurst": 0.7,
                    "lyapunov": 0.01,
                    "market_regime": "normal",
                    "memory_regime": "long_memory"
                  }
                },
                "node_ref": "t4",
                "risk": {
                  "alpha": 0.95,
                  "coherent": true,
                  "component_contribution": 10,
                  "distribution_id": "fp:t4",
                  "horizon": 1.0,
                  "measure": "expected_shortfall",
                  "n_samples": 250,
                  "provisional": false,
                  "risk_adjusted_return": 1.5,
                  "risk_ref": "economic-prophet@feat/risk-adjusted-profit-raroc:risk_measures.risk",
                  "standalone_capital": 15
                },
                "term": {
                  "average_life": 10.0,
                  "convexity": 90.0,
                  "duration": 8.0,
                  "kurtosis": 5.0,
                  "principal": 1000.0,
                  "skew": -0.5,
                  "tenor_bucket": "5y",
                  "term_regime": "upward",
                  "value": 1000.0
                }
              }
            ],
            "label": {
              "asset_class": "credit",
              "org_cut": "client_segment",
              "regime": {
                "fractal_dim": 1.3,
                "hurst": 0.7,
                "lyapunov": 0.01,
                "market_regime": "normal",
                "memory_regime": "long_memory"
              }
            },
            "node_ref": "Geo_EU",
            "risk": {
              "alpha": 0.95,
              "coherent": true,
              "economic_capital": 40,
              "horizon": 1.0,
              "measure": "expected_shortfall"
            },
            "term": {
              "average_life": 9.0,
              "convexity": 70.0,
              "duration": 7.0
            }
          }
        ],
        "label": {
          "asset_class": "credit",
          "org_cut": "client_segment",
          "regime": {
            "fractal_dim": 1.3,
            "hurst": 0.7,
            "lyapunov": 0.01,
            "market_regime": "normal",
            "memory_regime": "long_memory"
          }
        },